6_1568266395.794,人机交互,597,下一个革命性的人机交互方式会是什么？
7_1568266395.540,学习,23257,如何让大脑保持高速运行？
8_1568266395.596,工作经历,1076,那些在一个公司死磕了5~10年的人最后都怎么样了？
9_1568266395.152,王思聪,4419,王思聪天天上新闻，我特想知道马云的儿子在做什么（你看我连他名字都不知道）?
10_1568266395.112,思维,3048,什么是大格局？大格局的人有哪些表现和思维模式？
11_1568266395.87,编程语言,2737,如何看待风变编程的 Python 网课？
12_1568266396.801,互联网,1045,2019 Google 开发者大会上，什么最吸引你？
13_1568266396.840,科研,685,没有导师的指导，研究生如何阅读文献、提出创见、写论文？
14_1568266396.114,情感,1304,你和异性朋友做过最暧昧的事是什么？
15_1568266396.141,心理学,20092,你见过哪些厉害的商业思维？
16_1568266396.66,互联网,20426,有哪些鲜为人知，但是很有意思的网站？
17_1568266396.886,美国,26195,美国为什么不能通过印制美元来偿还中国购买的美国国债？
18_1568266396.750,心理学,3500,从你的经历来看，什么时候感到做一个中国人很幸福？
19_1568266396.664,学习,20299,哔哩哔哩有什么好玩的？
20_1568266396.151,Python,476,Python 有什么奇技淫巧？
21_1568266396.717,女生,30365,怎样把普通朋友变成女朋友？
22_1568266396.922,创业,4875,怎样在一年之内赚到 15 万元？
23_1568266396.786,清华大学,19355,普通人考清北需要多努力？
24_1568266397.461,ACG,234,如果没有辉夜，岸本有可能会怎么安排斑的结局？
25_1568266397.300,学习,41631,有哪些高质量的自学网站？
26_1568266397.922,股票,661,炒股的基本功是什么？
27_1568266397.851,增高,2662,花180万做断骨增高长高了15cm！结果全身照变霸王龙…
28_1568266397.896,求职,1575,找工作时单位普遍要求 35 岁以下，那 35 岁以上的人都干嘛去了？
29_1568266397.13,统计学,1710,好看的数据可视化的图片是怎么样做的？
30_1568266397.94,中央处理器 (CPU),605,龙芯现在怎么样？
31_1568266397.639,贷记卡,2517,那些欠网贷不还的人现在怎么样了？
32_1568266397.807,生物学,29890,有没有可能，氧气是种慢性毒气，通常需要 70-100 年来杀死人类？
33_1568266397.107,开放课程,1106,计算机专业有哪些不错的公开课资源？
34_1568266397.312,亚马逊 (Amazon.com),1778,个人如何做跨境电商？
35_1568266397.104,影视,803,50岁许晴上《男人装》，这身材和脸让我一女的感叹人间尤物。
